key	text	tooltip
incidents_localised_description_land_enc_incident_clean_up_event	We find the tower of a reclusive mage. In the floor small pieces of gold and in the walls small scribles of arcane knowledge that tells the stories of times long past. You absorb everything you can of it.	false
incidents_localised_title_land_enc_incident_battle_clean_up_event	A Too Vivid Dream	false
incidents_localised_description_land_enc_incident_battle_clean_up_event	You wake up with a chill and cold sweat all over your body. The dream was extremely vivid and you feel the adrenaline still running through your body as if you had been about to go into combat. But it was just a dream, nothing more. You feel reinvigorated by a strange force and you understand that the dream vision will eventually pass. You must prepare for the battle to come!\\n	false
incidents_localised_title_land_enc_incident_smithy_tribute	A Tribute From The Smithy	false
incidents_localised_description_land_enc_incident_smithy_tribute	My warmest regards, my lord. Thank you for protecting our smithy from our enemies and the dangers that surround us. The master blacksmith sends you the promised tribute for your investment and protection. Use it for your war effort!	false
